{
  "slug": "four-k-tv",
  "object": "A 55-inch 4K smart TV, entry/mainstream tier: VIZIO SmartCast 55\" E-Series Ultra HD Home Theater Display (E55u-D0), 2016 \u2014 versus TCL 55Q651G (55\" Q-Series 4K QLED Google TV), 2026",
  "segment": "STILL CHEAP",
  "spec_note": "Like-for-like is held on FOUR axes: 55-inch class \u00b7 3840x2160 (true 4K/UHD, not 1080p) \u00b7 LED-backlit LCD (no OLED on either side) \u00b7 mass-market brand's ENTRY 4K smart-TV line. 2016 anchor = VIZIO E55u-D0, the 55-inch Ultra HD model of VIZIO's cheapest 2016 SmartCast line, MSRP $699.99. 2026 anchor = TCL 55Q651G, the 55-inch model of TCL's cheapest current 4K line, $319.96-$319.99 street. THREE ASTERISKS, stated rather than hidden: (1) The 2016 figure is a manufacturer MSRP at announcement; the 2026 figure is a shelf price. Street prices fell inside 2016 too \u2014 TechRadar's review of the LG 55UH7700 quotes $999 against a $1,799 launch MSRP \u2014 so the true street-to-street fall is smaller than MSRP-to-street. (2) The 2026 set is BETTER, not merely cheaper (QLED, HDR10+/HLG, Google TV, higher brightness), so this understates the per-unit-quality collapse; the BLS constant-quality televisions index fell 67.1% over the same window. (3) TIER TRAP AVOIDED: the well-known Vizio E55-D0 is 1080p, NOT 4K \u2014 the 4K sibling is the E55u-D0 and it cost $130 more ($699.99 vs $569.99). Both figures appear in the same press release and in the artifact screenshot. A tier-matched premium check is carried as claims c3/c4 so the entry-tier headline cannot be read as cherry-picking.",
  "claims": [
    {
      "id": "c1-2016-entry-55in-4k",
      "text": "In April 2016 the cheapest 55-inch 4K smart TV in VIZIO's line, the SmartCast E-Series Ultra HD Home Theater Display (E55u-D0), launched at an MSRP of $699.99.",
      "value": 699.99,
      "currency": "USD",
      "year": 2016,
      "estimated": false,
      "inflation_adjusted_value": 967.58,
      "sources": [
        {
          "url": "https://www.prnewswire.com/news-releases/vizio-smartcast-e-series-ultra-hd-home-theater-display-joins-next-generation-smart-entertainment-ecosystem-with-ultra-hd-picture-quality-300253366.html",
          "kind": "primary",
          "publisher": "VIZIO, Inc. (manufacturer press release, distributed via PR Newswire)",
          "snapshot_date": "2016-04-19",
          "accessed": "2026-08-03",
          "quote": "VIZIO SmartCast \u2122 55\" E-Series \u2122 Ultra HD Home Theater Display \u2122 (E55u-D0) MSRP $699.99 \u2014 dateline: \"IRVINE, Calif., April 19, 2016 /PRNewswire/ -- VIZIO, Inc. announced today its all-new VIZIO SmartCast \u2122 E-Series \u2122 Home Theater Display \u2122 collection\". Same table, one line above: \"VIZIO SmartCast \u2122 55\" E-Series \u2122 HDTV \u2122 (E55-D0) MSRP $569.99\" \u2014 the 1080p sibling."
        },
        {
          "url": "https://www.reviewed.com/televisions/news/vizio-debuts-2016-m-series-e-series-tvs-with-smartcast",
          "kind": "secondary",
          "publisher": "Reviewed.com (contemporaneous journalism)",
          "snapshot_date": "2016-04-19",
          "accessed": "2026-08-03",
          "quote": "Here's a full price breakdown for the 2016 E-Series: 1080P: ... \u2022 55\" (E55-D0) \u2014 MSRP $569.99 / 4K UHD: ... \u2022 55\u201d (E55u-D0) \u2014 MSRP $699.99 (page datePublished 2016-04-19T13:00:00Z)"
        },
        {
          "url": "https://data.bls.gov/timeseries/CUUR0000SA0",
          "kind": "primary",
          "publisher": "U.S. Bureau of Labor Statistics",
          "series_id": "CUUR0000SA0",
          "accessed": "2026-08-03",
          "quote": "Series Title: All items in U.S. city average, all urban consumers, not seasonally adjusted. Base Period: 1982-84=100. 2016 Apr = 239.261; 2026 Jul = 330.724. \"Data extracted on: August 2, 2026 (8:48:55 PM)\". Deflator used: 330.724 / 239.261 = 1.382273; 699.99 x 1.382273 = 967.58."
        }
      ]
    },
    {
      "id": "c2-2026-entry-55in-4k",
      "text": "On 3 August 2026 the TCL 55Q651G \u2014 a 55-inch 4K QLED Google TV, TCL's entry 4K line \u2014 sold for $319.96 at P.C. Richard & Son and $319.99 at TCL's own US store.",
      "value": 319.96,
      "currency": "USD",
      "year": 2026,
      "estimated": false,
      "inflation_adjusted_value": 319.96,
      "sources": [
        {
          "url": "https://www.pcrichard.com/tcl-55-class-q-series-qled-4k-uhd-smart-google-tv/55Q651G.html",
          "kind": "primary",
          "publisher": "P.C. Richard & Son (live retail listing)",
          "accessed": "2026-08-03",
          "quote": "schema.org Product/Offer embedded in the page: {\"priceCurrency\":\"USD\",\"price\":\"319.96\",\"availability\":\"http://schema.org/InStock\",\"seller\":{\"name\":\"P.C. Richard & Son\"}}. On-page: \"TCL - 55\\\" Class Q-Series QLED 4K UHD Smart Google TV ... Panel Type: QLED \u00b7 Display Resolution: 4K Ultra HD (2160p) \u00b7 Screen Size Class: 55 Inch ... $319.96\". Analytics payload confirms item_id \"55Q651G\", price 319.96."
        },
        {
          "url": "https://us.tcl.com/products/q-class-4k-uhd-hdr-qled-smart-tv-with-google-tv.json",
          "kind": "primary",
          "publisher": "TCL North America official US store (us.tcl.com)",
          "accessed": "2026-08-03",
          "quote": "Product \"Q Class 4K UHD HDR QLED Smart TV with Google TV\", variant title \"55\\\"\", sku \"55Q651G\", price \"319.99\", compare_at_price \"399.99\". Product page: https://us.tcl.com/products/q-class-4k-uhd-hdr-qled-smart-tv-with-google-tv"
        },
        {
          "url": "https://www.newegg.com/p/pl?d=55QD65QF",
          "kind": "primary",
          "publisher": "Newegg.com (live retail listing, third independent seller, tier corroboration)",
          "accessed": "2026-08-03",
          "quote": "\"Hisense 55QD65QF 55 inch Class QD6 Series 4K QLED Smart Fire TV \u2014 Model #: 55QD65QF \u2014 $299.99\" (new, not refurbished). Corroborates that the entry 55-inch 4K tier clears at roughly $300 on the same day."
        }
      ]
    },
    {
      "id": "c3-2016-premium-55in-4k-led",
      "text": "Tier-matched check: in March 2016 LG's cheapest SUPER UHD (premium 4K LED) 55-inch set, the 55UH7700, carried a suggested price of $1,799.",
      "value": 1799,
      "currency": "USD",
      "year": 2016,
      "estimated": false,
      "inflation_adjusted_value": 2498.5,
      "sources": [
        {
          "url": "https://www.lg.com/us/PDF/press-release/SUPER%20UHD%20Availability%20and%20Pricing%20Release_Embargoed%203%2010%2016%208AM%20EST%20FINAL.pdf",
          "kind": "primary",
          "publisher": "LG Electronics USA (manufacturer press release PDF hosted on lg.com)",
          "snapshot_date": "2016-03-10",
          "accessed": "2026-08-03",
          "quote": "\"ENGLEWOOD CLIFFS, N.J., March 10, 2016 \u2013 LG Electronics USA today announced pricing and availability for its 2016 \u2018LG SUPER UHD TV\u2019 series, the company's premium line of LED-backlit LCD 4K UHD TVs\" ... \"UH7700 - SUPER UHD TV o 55-inch class (54.6 inches diagonal) model 55UH7700: $1,799\" (also \"55-inch class ... model 55UH8500: $1,999\")."
        },
        {
          "url": "https://www.digitaltrends.com/home-theater/lg-2016-super-uhd-4k-hdr-tv-lineup-pricing-availability/",
          "kind": "secondary",
          "publisher": "Digital Trends (contemporaneous journalism, datePublished 2016-03-10T13:00:26+00:00)",
          "snapshot_date": "2016-03-10",
          "accessed": "2026-08-03",
          "quote": "\"The 65-inch class 65UH7700 sells for $2,800, while the 60-inch and 55-inch class models sell for $2,100 and $1,800 respectively.\" (Digital Trends rounds LG's $1,799 to $1,800.)"
        },
        {
          "url": "https://www.techradar.com/reviews/lg-55uh7700",
          "kind": "secondary",
          "publisher": "TechRadar (review, price in body \u2014 recorded as the STREET-vs-MSRP asterisk, not as the MSRP)",
          "accessed": "2026-08-03",
          "quote": "\"It even looks like a good value at $999, too, considering it supports high dynamic range and native 4K playback.\" and \"As if the 55UH7700\u2019s sub-$1,000 price, 4K and HDR features weren\u2019t already attractive enough...\" \u2014 evidence that the 2016 street price fell well below the launch MSRP within the model year."
        }
      ]
    },
    {
      "id": "c4-2026-premium-55in-4k-led",
      "text": "Tier-matched check, 2026 side: on 3 August 2026 Samsung's flagship 55-inch LED set, the Neo QLED QN55QN90F, listed at $1,297.99 \u2014 against $2,299 for Samsung's flagship flat 55-inch LED in 2016 (UN55KS9000).",
      "value": 1297.99,
      "currency": "USD",
      "year": 2026,
      "estimated": false,
      "inflation_adjusted_value": 1297.99,
      "sources": [
        {
          "url": "https://www.newegg.com/p/pl?d=QN55QN90FAFXZA",
          "kind": "primary",
          "publisher": "Newegg.com (live retail listing)",
          "accessed": "2026-08-03",
          "quote": "\"Samsung QN90F Neo QLED TV 55-Inch 4K Smart in Titan Black - QN55QN90FAFXZA \u2014 Model #: QN55QN90FAFXZA \u2014 $1,297.99 \u2014 More options from $1,197.99 - $1,887.99 \u2014 Free Shipping\" (new, not refurbished)."
        },
        {
          "url": "https://www.forbes.com/sites/johnarcher/2016/04/12/samsungs-2016-suhd-tv-line-up-details-with-prices/",
          "kind": "secondary",
          "publisher": "Forbes / John Archer, 12 April 2016 (the 2016 comparison point in this claim)",
          "snapshot_date": "2016-04-12",
          "accessed": "2026-08-03",
          "quote": "KS9000 series: \"Size options: 75-inch (June, $6,499), 65-inch (now, $3,499/\u00a32,700), 55-inch ($2,299/\u00a31,900). ... Resolution: 4K\". Same article: KS9500 55-inch $2,499; KS8500 55-inch $1,999; KS8000 55-inch $1,799."
        }
      ]
    },
    {
      "id": "c5-bls-constant-quality-televisions",